{
        "title": "The Enchanted Forest",
        "description": "In a land forgotten by time, an ancient curse has plunged the Enchanted Forest into eternal twilight. Enter the forest and unravel the mysteries that bind the land in darkness.",
        "characters": {
          "the-forest-queen": {
            "name": "The Forest Queen",
            "initial_role": "protagonist",
            "description": "The wise and powerful ruler of the Enchanted Forest, seeking to end the curse that has befallen her realm.",
            "decks": {
              "action": {
                "FQ_A001": {
                  "title": "Nature's Wrath",
                  "description": "Unleashes the power of nature against enemies.",
                  "influence": 10,
                  "success_rate": 80,
                  "influence_rate": 120
                },
                "FQ_A002": {
                  "title": "Healing Breeze",
                  "description": "Restores health to allies.",
                  "influence": 8,
                  "success_rate": 90,
                  "influence_rate": 100
                },
                "FQ_A003": {
                  "title": "Shield of Thorns",
                  "description": "Creates a protective barrier of thorns around allies.",
                  "influence": 7,
                  "success_rate": 85,
                  "influence_rate": 110
                },
                "FQ_A004": {
                  "title": "Summon Woodland Creatures",
                  "description": "Calls upon woodland creatures to assist in battle.",
                  "influence": 9,
                  "success_rate": 75,
                  "influence_rate": 100
                },
                "FQ_A005": {
                  "title": "Verdant Growth",
                  "description": "Causes rapid plant growth to entangle enemies.",
                  "influence": 6,
                  "success_rate": 70,
                  "influence_rate": 90
                },
                "FQ_A006": {
                  "title": "Gale Force",
                  "description": "Summons powerful winds to knock back foes.",
                  "influence": 8,
                  "success_rate": 80,
                  "influence_rate": 110
                },
                "FQ_A007": {
                  "title": "Soothing Rain",
                  "description": "Calls down a gentle rain that rejuvenates allies.",
                  "influence": 7,
                  "success_rate": 90,
                  "influence_rate": 100
                },
                "FQ_A008": {
                  "title": "Sunbeam",
                  "description": "Channels a focused beam of sunlight to blind and damage enemies.",
                  "influence": 9,
                  "success_rate": 75,
                  "influence_rate": 110
                },
                "FQ_A009": {
                  "title": "Roots of the Earth",
                  "description": "Causes roots to erupt from the ground, restraining enemies.",
                  "influence": 8,
                  "success_rate": 85,
                  "influence_rate": 100
                },
                "FQ_A010": {
                  "title": "Nature's Resilience",
                  "description": "Grants temporary invulnerability to an ally by surrounding them with natural energy.",
                  "influence": 10,
                  "success_rate": 95,
                  "influence_rate": 100
                },
                "FQ_A011": {
                  "title": "Nature's Wrath",
                  "description": "Unleashes the power of nature against enemies.",
                  "influence": 7,
                  "success_rate": 75,
                  "influence_rate": 110
                },
                "FQ_A012": {
                  "title": "Nature's Wrath",
                  "description": "Unleashes the power of nature against enemies.",
                  "influence": 12,
                  "success_rate": 70,
                  "influence_rate": 120
                },
                "FQ_A013": {
                  "title": "Healing Breeze",
                  "description": "Restores health to allies.",
                  "influence": 10,
                  "success_rate": 80,
                  "influence_rate": 110
                },
                "FQ_A014": {
                  "title": "Healing Breeze",
                  "description": "Restores health to allies.",
                  "influence": 6,
                  "success_rate": 95,
                  "influence_rate": 90
                },
                "FQ_A015": {
                  "title": "Shield of Thorns",
                  "description": "Creates a protective barrier of thorns around allies.",
                  "influence": 9,
                  "success_rate": 70,
                  "influence_rate": 110
                },
                "FQ_A016": {
                  "title": "Gale Force",
                  "description": "Summons powerful winds to knock back foes.",
                  "influence": 10,
                  "success_rate": 85,
                  "influence_rate": 120
                },
                "FQ_A017": {
                  "title": "Sunbeam",
                  "description": "Channels a focused beam of sunlight to blind and damage enemies.",
                  "influence": 12,
                  "success_rate": 65,
                  "influence_rate": 120
                },
                "FQ_A018": {
                  "title": "Roots of the Earth",
                  "description": "Causes roots to erupt from the ground, restraining enemies.",
                  "influence": 6,
                  "success_rate": 90,
                  "influence_rate": 100
                },
                "FQ_A019": {
                  "title": "Nature's Resilience",
                  "description": "Grants temporary invulnerability to an ally by surrounding them with natural energy.",
                  "influence": 8,
                  "success_rate": 90,
                  "influence_rate": 100
                },
                "FQ_A020": {
                  "title": "Nature's Wrath",
                  "description": "Unleashes the power of nature against enemies.",
                  "influence": 9,
                  "success_rate": 85,
                  "influence_rate": 110
                }
              },
              "social": {
                "FQ_S001": {
                  "title": "Royal Command",
                  "description": "Commands respect and obedience.",
                  "influence": 10,
                  "success_rate": 90,
                  "influence_rate": 120
                },
                "FQ_S002": {
                  "title": "Diplomatic Grace",
                  "description": "Uses diplomacy to resolve conflicts.",
                  "influence": 8,
                  "success_rate": 85,
                  "influence_rate": 100
                },
                "FQ_S003": {
                  "title": "Soothing Words",
                  "description": "Calms hostile emotions and fosters cooperation.",
                  "influence": 7,
                  "success_rate": 80,
                  "influence_rate": 110
                },
                "FQ_S004": {
                  "title": "Inspiring Speech",
                  "description": "Inspires allies to take bold actions.",
                  "influence": 9,
                  "success_rate": 75,
                  "influence_rate": 100
                },
                "FQ_S005": {
                  "title": "Royal Decree",
                  "description": "Issues a decree to influence an NPC's decisions.",
                  "influence": 6,
                  "success_rate": 95,
                  "influence_rate": 90
                },
                "FQ_S006": {
                  "title": "Noble Presence",
                  "description": "The Forest Queen's mere presence influences those around her.",
                  "influence": 8,
                  "success_rate": 85,
                  "influence_rate": 110
                },
                "FQ_S007": {
                  "title": "Binding Pact",
                  "description": "Forms a pact with an NPC for mutual benefit.",
                  "influence": 7,
                  "success_rate": 80,
                  "influence_rate": 100
                },
                "FQ_S008": {
                  "title": "Words of Wisdom",
                  "description": "Offers advice that steers the situation favorably.",
                  "influence": 9,
                  "success_rate": 90,
                  "influence_rate": 100
                },
                "FQ_S009": {
                  "title": "Charismatic Aura",
                  "description": "The Forest Queen's charisma sways opinions.",
                  "influence": 8,
                  "success_rate": 85,
                  "influence_rate": 100
                },
                "FQ_S010": {
                  "title": "Royal Command",
                  "description": "Commands respect and obedience.",
                  "influence": 7,
                  "success_rate": 85,
                  "influence_rate": 110
                },
                "FQ_S011": {
                  "title": "Royal Command",
                  "description": "Commands respect and obedience.",
                  "influence": 12,
                  "success_rate": 75,
                  "influence_rate": 120
                },
                "FQ_S012": {
                  "title": "Diplomatic Grace",
                  "description": "Uses diplomacy to resolve conflicts.",
                  "influence": 10,
                  "success_rate": 80,
                  "influence_rate": 110
                },
                "FQ_S013": {
                  "title": "Diplomatic Grace",